{"$schema":"https://json-schema.org/draft/2020-12/schema","$id":"https://catalog.local/schemas/v1/audit-input.schema.json","title":"audit-input","type":"object","additionalProperties":false,"required":["schema_version","fixture_only","artifact_references","required_artifact_types","trusted_root_fingerprints","audit_bundle"],"properties":{"schema_version":{"const":"1.0.0"},"fixture_only":{"type":"boolean"},"artifact_references":{"type":"array","minItems":1,"items":{"$ref":"#/$defs/reference"}},"required_artifact_types":{"type":"array","uniqueItems":true,"items":{"type":"string"}},"trusted_root_fingerprints":{"type":"array","uniqueItems":true,"items":{"$ref":"common-definitions.schema.json#/$defs/sha256"}},"audit_bundle":{"type":"object"}},"$defs":{"reference":{"type":"object","additionalProperties":false,"required":["artifact_type","schema_version","path","sha256","size","producer","producer_fingerprint","policy_version","scope","identity"],"properties":{"artifact_type":{"type":"string","minLength":1},"schema_version":{"const":"1.0.0"},"path":{"type":"string","pattern":"^(?!/)(?!.*\\\\)(?!.*(?:^|/)\\.\\.(?:/|$)).+$"},"sha256":{"$ref":"common-definitions.schema.json#/$defs/sha256"},"size":{"type":"integer","minimum":0},"producer":{"type":"string","minLength":1},"producer_fingerprint":{"$ref":"common-definitions.schema.json#/$defs/sha256"},"policy_version":{"type":"string","minLength":1},"scope":{"type":"string","minLength":1},"identity":{"type":["string","null"]}}}}}
