{"schema_version":"1.0.0","fixture_only":true,"artifact_references":[{"artifact_type":"normalization_manifest","schema_version":"1.0.0","path":"synthetic/normalization-manifest.json","sha256":"aaaaaaaaaaaaaaaaaaaaaaaaaaaaaaaaaaaaaaaaaaaaaaaaaaaaaaaaaaaaaaaa","size":1,"producer":"catalog-normalize","producer_fingerprint":"bbbbbbbbbbbbbbbbbbbbbbbbbbbbbbbbbbbbbbbbbbbbbbbbbbbbbbbbbbbbbbbb","policy_version":"normalization-ep-v1","scope":"catalog","identity":null}],"required_artifact_types":["normalization_manifest"],"trusted_root_fingerprints":[],"audit_bundle":{}}
